[
  {
    "anchor": "Hoofdstuk2_Paragraaf5_Artikel2.51",
    "title": "Artikel 2.51. Eindexamen",
    "text": "Artikel 2.51. Eindexamen\n1\nHet bevoegd gezag geeft de leerlingen de gelegenheid om het onderwijs af te sluiten\n met een eindexamen op de school, tenzij in de plaats daarvan de gelegenheid bestaat\n tot het afleggen van een eindexamen dat niet vanwege de school wordt afgenomen en\n het bevoegd gezag in verband hiermee een eindexamen aan de school niet nodig oordeelt.\n2\nHet bevoegd gezag kan personen die niet als leerling aan de school zijn ingeschreven,\n in de gelegenheid stellen een diploma te behalen door hen als extraneus tot het eindexamen\n toe te laten.\n3\nDe rector of directeur en de examinatoren nemen het eindexamen af, onder verantwoordelijkheid\n van het bevoegd gezag. Examinatoren kunnen zijn de conrector, adjunct-directeur, leden\n van de centrale directie en leraren van de school.\n4\nHet bevoegd gezag kan een of meer deskundigen aanwijzen die het eindexamen ook afnemen,\n onder verantwoordelijkheid van het bevoegd gezag.\n5\nBij of krachtens algemene maatregel van bestuur worden nadere regels gesteld over\n de toelating van een extraneus tot het eindexamen, waaronder de gevallen waarin een\n extraneus een financiële bijdrage is verschuldigd en de hoogte daarvan.\n6\nBij algemene maatregel van bestuur kunnen regels worden gesteld over examens die niet\n vanwege de school worden afgenomen.",
    "fragment_id": "wvo-2020#Hoofdstuk2_Paragraaf5_Artikel2.51",
    "source_id": "wvo-2020",
    "url": "https://wetten.overheid.nl/BWBR0044212/2026-08-01#Hoofdstuk2_Paragraaf5_Artikel2.51",
    "content_kind": "verbatim_article",
    "valid_from": "2026-08-01",
    "text_hash": "0abf67d6743ae701fbc2ccfddbd689992902870ee51c88be452e4c3b9a582d13"
  },
  {
    "anchor": "Hoofdstuk2_Paragraaf5_Artikel2.51a",
    "title": "Artikel 2.51a. De examensecretaris",
    "text": "Artikel 2.51a. De examensecretaris\n1\nDe rector of directeur wijst een of meer van de personeelsleden van de school aan\n tot examensecretaris van het eindexamen.\n2\nDe rector of directeur en de examensecretaris verrichten gezamenlijk de taken bedoeld\n in de\nartikelen 2.57, tweede lid\n, en\n2.58, vierde lid\n.\n3\nDe examensecretaris heeft de taak om de rector of directeur te ondersteunen bij:\na.\nhet organiseren en afnemen van het eindexamen;\nb.\nde uitvoering van het examenreglement, bedoeld in\nartikel 2.60, eerste lid\n;\nc.\nde uitvoering van het programma van toetsing en afsluiting, bedoeld in\nartikel 2.60a, eerste lid\n; en\nd.\nde verstrekking van de beoordeling van het schoolexamen, bedoeld in\nartikel 2.55a\n.\n4\nDe rector of directeur stelt een taakomschrijving voor de examensecretaris vast waarin\n in ieder geval de taken bedoeld in het tweede en derde lid worden opgenomen.\n5\nDe rector of directeur verstrekt de taakomschrijving aan het bevoegd gezag, aan de\n examensecretaris en aan de examencommissie.\n6\nDe rector of directeur draagt er zorg voor dat het deskundig functioneren van de examensecretaris\n is gewaarborgd.\n7\nBij algemene maatregel van bestuur kunnen nadere regels worden gesteld over de taken\n van de examensecretaris.",
    "fragment_id": "wvo-2020#Hoofdstuk2_Paragraaf5_Artikel2.51a",
    "source_id": "wvo-2020",
    "url": "https://wetten.overheid.nl/BWBR0044212/2026-08-01#Hoofdstuk2_Paragraaf5_Artikel2.51a",
    "content_kind": "verbatim_article",
    "valid_from": "2026-08-01",
    "text_hash": "255587c68b14e79a4bc272814c9befa79c0c577e6231712cb69a2e0e97f5194f"
  },
  {
    "anchor": "Hoofdstuk2_Paragraaf5_Artikel2.52",
    "title": "Artikel 2.52. Afnametaal bij toetsen en examens",
    "text": "Artikel 2.52. Afnametaal bij toetsen en examens\n1\nDe toetsen en examens als onderdeel van het eindexamen worden afgenomen in het Nederlands.\n2\nBij het afnemen van toetsen en examens kan een andere taal dan het Nederlands worden\n gebruikt als:\na.\nde toetsen en examens betrekking hebben op die andere taal;\nb.\ndat noodzakelijk is vanwege de specifieke aard, de inrichting of de kwaliteit van\n het onderwijs; of\nc.\ndat noodzakelijk is vanwege de herkomst van de leerlingen.\n3\nHet bevoegd gezag stelt voor de school een gedragscode vast voor het gebruik van een\n andere taal dan het Nederlands bij toetsen en examens in de gevallen, bedoeld in het\n tweede lid, onderdelen b en c.",
    "fragment_id": "wvo-2020#Hoofdstuk2_Paragraaf5_Artikel2.52",
    "source_id": "wvo-2020",
    "url": "https://wetten.overheid.nl/BWBR0044212/2026-08-01#Hoofdstuk2_Paragraaf5_Artikel2.52",
    "content_kind": "verbatim_article",
    "valid_from": "2026-08-01",
    "text_hash": "49e53108fdb8211ecfb22f6b648cef63dcd70cf1a952c587eb052f963236f1f6"
  },
  {
    "anchor": "Hoofdstuk2_Paragraaf5_Artikel2.53",
    "title": "Artikel 2.53. Inhoud eindexamen",
    "text": "Artikel 2.53. Inhoud eindexamen\n1\nHet bevoegd gezag stelt de examenkandidaat in de gelegenheid met inachtneming van\n de bij of krachtens deze paragraaf gestelde bepalingen de vakken of andere programmaonderdelen\n waarin hij eindexamen aflegt te kiezen, voor zover het bevoegd gezag, al dan niet\n in samenwerking met het bevoegd gezag van een of meer andere scholen, de examenkandidaat\n in de gelegenheid heeft gesteld zich op het examen in die vakken voor te bereiden.\n2\nHet eindexamen bestaat voor elk vak of ander programmaonderdeel uit een schoolexamen\n of een centraal examen, of uit beide.\n3\nHet schoolexamen vwo, havo en vmbo wat de theoretische leerweg en de gemengde leerweg\n betreft, omvat een profielwerkstuk. Het profielwerkstuk is een werkstuk, een presentatie\n daaronder begrepen, waarin op geïntegreerde wijze kennis, inzicht en vaardigheden\n aan de orde komen die van betekenis zijn in het betrokken profiel.\n4\nBij of krachtens algemene maatregel van bestuur worden:\na.\nde vakken geregeld die het eindexamen in elk geval omvat en worden nadere regels gesteld\n over de keuze die de examenkandidaat kan of dient te maken uit vakken of andere onderdelen\n van het eindexamen;\nb.\nregels gesteld over de mogelijkheid dat de examenkandidaat die is ingeschreven voor\n de schoolsoort havo, mavo of vbo eindexamen aflegt in vervangende vakken van een hoger\n niveau dan de schoolsoort of leerweg van zijn inschrijving;\nc.\nregels gesteld over de mogelijkheid dat de examenkandidaat in extra vakken eindexamen\n aflegt;\nd.\nregels gesteld over de onderdelen die het eindexamen bovendien kan omvatten;\ne.\nregels gesteld over de vrijstelling voor en ontheffing van vakken of andere onderdelen\n van het eindexamen;\nf.\nnadere regels gesteld over het profielwerkstuk; en\ng.\nregels gesteld over de spreiding van het eindexamen voor examenkandidaten die in het\n laatste leerjaar wegens ziekte of een bijzondere, andere, van de wil van de kandidaat\n onafhankelijke omstandigheid niet in staat zijn geweest het onderwijs in alle betrokken\n vakken of andere programmaonderdelen te volgen.",
    "fragment_id": "wvo-2020#Hoofdstuk2_Paragraaf5_Artikel2.53",
    "source_id": "wvo-2020",
    "url": "https://wetten.overheid.nl/BWBR0044212/2026-08-01#Hoofdstuk2_Paragraaf5_Artikel2.53",
    "content_kind": "verbatim_article",
    "valid_from": "2026-08-01",
    "text_hash": "d6be5862220a2dc2e5cdfebd1bb755eb60789acad22ca2566d44b4822baec051"
  },
  {
    "anchor": "Hoofdstuk2_Paragraaf5_Artikel2.54",
    "title": "Artikel 2.54. Examenprogramma’s",
    "text": "Artikel 2.54. Examenprogramma’s\n1\nBij ministeriële regeling wordt, behalve voor door het bevoegd gezag vast te stellen\n vakken die onderdeel zijn van het eindexamen, per schoolsoort en leerweg per vak of\n voor groepen vakken een examenprogramma vastgesteld.\n2\nHet examenprogramma bevat in elk geval:\na.\neen omschrijving van de examenstof voor ieder eindexamenvak; en\nb.\nde verdeling van de examenstof over het schoolexamen en het centraal examen, indien\n in een vak zowel het schoolexamen als het centraal examen wordt afgenomen.\n3\nBij de vaststelling van de examenprogramma’s voor Nederlandse taal en literatuur respectievelijk\n Nederlandse taal worden de referentieniveaus in acht genomen, bedoeld in\nartikel 2, tweede lid, aanhef en onderdeel c, van de Wet referentieniveaus Nederlandse\n taal en rekenen\n.",
    "fragment_id": "wvo-2020#Hoofdstuk2_Paragraaf5_Artikel2.54",
    "source_id": "wvo-2020",
    "url": "https://wetten.overheid.nl/BWBR0044212/2026-08-01#Hoofdstuk2_Paragraaf5_Artikel2.54",
    "content_kind": "verbatim_article",
    "valid_from": "2026-08-01",
    "text_hash": "066c71030579914281461051ee2e852fce0cd0f00ebe725886eac5aa92ba7628"
  },
  {
    "anchor": "Hoofdstuk2_Paragraaf5_Artikel2.55",
    "title": "Artikel 2.55. Schoolexamen",